{
  "artifact_family": "provider_output",
  "schema_version": "1.0.0",
  "provider_adapter_version": "provider-adapter-kernel-v0.1",
  "provider_kind": "api",
  "provider_name": "api_compatible_worker_stub",
  "provider_version": "0.1.0",
  "provider_raw_output_digest": "sha256:8c4f83e229891b52ea1f69eb9a6272241d52468abc1bec832fdeb53a000372b0",
  "provider_raw_output_ref": "runtime/devmasterd/loopback-hardening-validation/iteration-1/state/provider-evidence/raw/8c4f83e229891b52ea1f69eb9a6272241d52468abc1bec832fdeb53a000372b0.json",
  "provider_raw_output_size_bytes": 304,
  "provider_raw_output_storage": "artifact_store",
  "parsed_output": {
    "message": "stub provider completed",
    "artifact": "runtime/provider-evidence/stub-provider-output.json",
    "visible_output": true
  },
  "parse_schema_version": "1.0.0",
  "drift_detected": false,
  "drift_reasons": [],
  "cost_facts": {
    "project_id": "dev_master",
    "trace_id": "tr_item_a5301b3180b24db494b01d392256ce9c",
    "run_id": "run_2519bf9afcea4056bca2dd7f0cc28c20",
    "estimated_usd": 0.0,
    "actual_usd": 0.0,
    "per_project_daily_spend_usd": 0.0,
    "global_daily_spend_usd": 0.0,
    "ceiling_status": "within_limit",
    "policy_version": "cost-ceilings-v1"
  },
  "authorization_sensitive_use_allowed": true,
  "source_fixture_ref": "runtime/fixtures/provider-output.ok.json",
  "captured_at": "2026-04-30T10:42:54Z"
}
