{
  "artifact_family": "provider_output",
  "schema_version": "1.0.0",
  "provider_adapter_version": "provider-adapter-kernel-v0.1",
  "provider_kind": "api",
  "provider_name": "unknown_provider",
  "provider_version": "0.1.0",
  "provider_raw_output_digest": "sha256:7adc1c04a29d44219d8ea620bfed0e3a64783f5feba9b113e50269224e5808b8",
  "provider_raw_output_ref": "runtime/provider-evidence/raw/7adc1c04a29d44219d8ea620bfed0e3a64783f5feba9b113e50269224e5808b8.json",
  "provider_raw_output_size_bytes": 205,
  "provider_raw_output_storage": "artifact_store",
  "parsed_output": {},
  "parse_schema_version": "1.0.0",
  "drift_detected": true,
  "drift_reasons": [
    "missing_or_invalid_result_object",
    "provider_name_not_allowed",
    "provider_warnings_present"
  ],
  "cost_facts": {
    "project_id": "dev_master",
    "trace_id": "tr_provider_adapter_stub",
    "run_id": "run_provider_adapter_stub",
    "estimated_usd": 0.0,
    "actual_usd": 0.0,
    "per_project_daily_spend_usd": 0.0,
    "global_daily_spend_usd": 0.0,
    "ceiling_status": "within_limit",
    "policy_version": "cost-ceilings-v1"
  },
  "authorization_sensitive_use_allowed": false,
  "source_fixture_ref": "runtime/fixtures/provider-output.drift.json",
  "captured_at": "2026-04-30T10:20:20Z"
}
